<?xml version="1.0" encoding="UTF-8"?>
<!-- Copyright DASSAULT SYSTEMES 2013 -->
<Config xmlns="DS_DELPPWConfiguration" xmlns:xsi="http://www.w3.org/2001/XMLSchema-instance" xsi:schemaLocation="DS_DELPPWConfiguration ../xsd/DuplicateAdvancedPreferences.xsd" Title="Duplicate advanced preferences" Description="Sample configuration file delivered by DS.">
  <Preferences>
    <DuplicateAdvanced showOptionPanel="true">
      <PrefixOption isDisplayed="true" defaultValue=""/>
      <LinkOption name="KeepImplementLinksOnProcess" isDisplayed="true" defaultValue="false"/>
      <LinkOption name="KeepOutputLinksOnProcess" isDisplayed="true" defaultValue="false"/>
      <LinkOption name="KeepCapableResourceLinksOnProcess" isDisplayed="true" defaultValue="false"/>
      <LinkOption name="KeepHowToLinksOnProcess" isDisplayed="true" defaultValue="false"/>
      <LinkOption name="KeepImplementLinksOnSystem" isDisplayed="true" defaultValue="false"/>
      <LinkOption name="KeepOutputLinksToPrdOnSystem" isDisplayed="true" defaultValue="false"/>
      <LinkOption name="KeepOutputLinksToMBOMOnSystem" isDisplayed="true" defaultValue="true"/>
      <LinkOption name="KeepCapableResourceLinksOnSystem" isDisplayed="true" defaultValue="true"/>
      <LinkOption name="KeepHowToLinksOnSystem" isDisplayed="true" defaultValue="false"/>
      <LinkOption name="KeepCandidateResourceLinksOnSystem" isDisplayed="true" defaultValue="false"/>
      <LinkOption name="KeepImplementLinksOnResource" isDisplayed="true" defaultValue="false"/>
    </DuplicateAdvanced>
  </Preferences>
</Config>
